{
  "id": "skill-runtime",
  "version": "0.1.0",
  "status": "active",
  "confidence": 0.65,
  "coverage": 0.4,
  "extends": [],
  "rule_packs": ["skills"],
  "path_hints": [
    "SKILL.md",
    "skills/",
    "SKILLs/",
    "skills.config.json",
    "optional-skills/"
  ],
  "known_limitations": [
    "Phase 1 skill analysis uses static patterns and does not run skill code."
  ]
}
