{
  "id": "mcp-server",
  "version": "0.1.0",
  "status": "active",
  "confidence": 0.65,
  "coverage": 0.45,
  "extends": [],
  "rule_packs": ["mcp"],
  "path_hints": [
    "mcp.json",
    "mcp*.json",
    "claude_desktop_config.json",
    ".vscode/mcp.json"
  ],
  "known_limitations": [
    "Phase 1 detects MCP configuration patterns but does not execute MCP servers."
  ]
}
